[
  {"id": "RT-01", "url": "https://ejemplo.test/", "category": "Rutas", "check": "Rutas 200",
   "method": "crawler", "status": "PASS", "severity": "Crítica"},
  {"id": "UI-01", "url": "https://ejemplo.test/pricing", "category": "UI/UX", "check": "Touch target >=44px",
   "method": "measure", "status": "FAIL", "severity": "Alta",
   "evidence": {"locator": "button.buy", "box": {"w": 32, "h": 28}, "screenshot": "evidence/buy.png"},
   "recommendation": "Aumentar a 44px", "wcag_ref": "2.5.5"},
  {"id": "AC-02", "url": "https://ejemplo.test/", "category": "Accesibilidad", "check": "Contraste AA",
   "method": "axe", "status": "PASS", "severity": "Alta"},
  {"id": "SE-01", "url": "https://ejemplo.test/", "category": "SEO", "check": "Title y description en rango",
   "method": "DOM crawl", "status": "PASS", "severity": "Alta"},
  {"id": "MO-01", "url": "https://ejemplo.test/", "category": "Motion", "check": "Reduced motion",
   "method": "emulate", "status": "N/A", "severity": "Alta"}
]
